{
  "schema_version": 1,
  "collection_key": "example-collection",
  "source_revision": "illustrative-2026-07-17",
  "created_at": "2026-07-17T15:45:00Z",
  "authentication": {
    "secret_ref": "EXAMPLE_RELEASE_TOKEN"
  },
  "expected_member_count": 2,
  "members": [
    {
      "watershed_key": "example-north",
      "runid": "illustrative/north",
      "display_name": "Example North",
      "aliases": ["legacy/example-north"],
      "artifacts": {
        "metadata": {"uri": "https://artifacts.example.test/example-north/metadata.json", "sha256": "1010101010101010101010101010101010101010101010101010101010101010", "bytes": 128, "media_type": "application/json", "verified": true},
        "boundary": {"uri": "https://artifacts.example.test/example-north/boundary.geojson", "sha256": "1111111111111111111111111111111111111111111111111111111111111111", "bytes": 1024, "media_type": "application/geo+json", "verified": true},
        "subcatchments": {"uri": "https://artifacts.example.test/example-north/subcatchments.geojson", "sha256": "1212121212121212121212121212121212121212121212121212121212121212", "bytes": 2048, "media_type": "application/geo+json", "verified": true},
        "channels": {"uri": "https://artifacts.example.test/example-north/channels.geojson", "sha256": "1313131313131313131313131313131313131313131313131313131313131313", "bytes": 2048, "media_type": "application/geo+json", "verified": true},
        "hillslopes": {"uri": "https://artifacts.example.test/example-north/hillslopes.geojson", "sha256": "1414141414141414141414141414141414141414141414141414141414141414", "bytes": 2048, "media_type": "application/geo+json", "verified": true},
        "soils": {"uri": "https://artifacts.example.test/example-north/soils.geojson", "sha256": "1515151515151515151515151515151515151515151515151515151515151515", "bytes": 2048, "media_type": "application/geo+json", "verified": true},
        "landuse": {"uri": "https://artifacts.example.test/example-north/landuse.geojson", "sha256": "1616161616161616161616161616161616161616161616161616161616161616", "bytes": 2048, "media_type": "application/geo+json", "verified": true}
      },
      "transformation_lineage": {"uri": "https://artifacts.example.test/example-north/transformation.json", "sha256": "1717171717171717171717171717171717171717171717171717171717171717", "bytes": 512, "media_type": "application/json", "verified": true},
      "rhessys_index": {"uri": "https://artifacts.example.test/example-north/rhessys.json", "sha256": "1818181818181818181818181818181818181818181818181818181818181818", "bytes": 512, "media_type": "application/json", "verified": true},
      "expected": {
        "watersheds": 1,
        "subcatchments": 4,
        "channels": 3,
        "bounds": [-117.2, 46.1, -116.8, 46.4]
      }
    },
    {
      "watershed_key": "example-south",
      "runid": "illustrative/south",
      "display_name": "Example South",
      "aliases": [],
      "artifacts": {
        "metadata": {"uri": "https://artifacts.example.test/example-south/metadata.json", "sha256": "2020202020202020202020202020202020202020202020202020202020202020", "bytes": 128, "media_type": "application/json", "verified": true},
        "boundary": {"uri": "https://artifacts.example.test/example-south/boundary.geojson", "sha256": "2121212121212121212121212121212121212121212121212121212121212121", "bytes": 1024, "media_type": "application/geo+json", "verified": true},
        "subcatchments": {"uri": "https://artifacts.example.test/example-south/subcatchments.geojson", "sha256": "2222222222222222222222222222222222222222222222222222222222222222", "bytes": 2048, "media_type": "application/geo+json", "verified": true},
        "channels": {"uri": "https://artifacts.example.test/example-south/channels.geojson", "sha256": "2323232323232323232323232323232323232323232323232323232323232323", "bytes": 2048, "media_type": "application/geo+json", "verified": true},
        "hillslopes": {"uri": "https://artifacts.example.test/example-south/hillslopes.geojson", "sha256": "2424242424242424242424242424242424242424242424242424242424242424", "bytes": 2048, "media_type": "application/geo+json", "verified": true},
        "soils": {"uri": "https://artifacts.example.test/example-south/soils.geojson", "sha256": "2525252525252525252525252525252525252525252525252525252525252525", "bytes": 2048, "media_type": "application/geo+json", "verified": true},
        "landuse": {"uri": "https://artifacts.example.test/example-south/landuse.geojson", "sha256": "2626262626262626262626262626262626262626262626262626262626262626", "bytes": 2048, "media_type": "application/geo+json", "verified": true}
      },
      "expected": {
        "watersheds": 1,
        "subcatchments": 5,
        "channels": 4,
        "bounds": [-116.9, 45.8, -116.5, 46.2]
      }
    }
  ]
}
