{"collection_key":"mill-creek","created_at":"2026-07-19T02:50:03Z","expected_member_count":1,"members":[{"aliases":["mdobre-invincible-scarab"],"artifacts":{"boundary":{"bytes":301423,"media_type":"application/geo+json","sha256":"7fbbf27a6a4f767c42dbf008f0841f346c898a32c993a4c6d576effb1fb1b192","uri":"https://firewisewatersheds.org/artifacts/v1/production/objects/sha256/7f/7fbbf27a6a4f767c42dbf008f0841f346c898a32c993a4c6d576effb1fb1b192","verified":true},"channels":{"bytes":1583484,"media_type":"application/geo+json","sha256":"1a1c266b0153384f277c551a74240af75b6e06685a62bf11334a1efc90657591","uri":"https://firewisewatersheds.org/artifacts/v1/production/objects/sha256/1a/1a1c266b0153384f277c551a74240af75b6e06685a62bf11334a1efc90657591","verified":true},"hillslopes":{"bytes":138502,"media_type":"application/vnd.apache.parquet","sha256":"9af5d774f4c0437a4be922e4cae7308a33d9cee8deb54e4d972d863d92b8c723","uri":"https://firewisewatersheds.org/artifacts/v1/production/objects/sha256/9a/9af5d774f4c0437a4be922e4cae7308a33d9cee8deb54e4d972d863d92b8c723","verified":true},"landuse":{"bytes":39132,"media_type":"application/vnd.apache.parquet","sha256":"8633fe64725524fa36147da3dd3bc8b6bfdafb3e22516c88364ef237ed088b4d","uri":"https://firewisewatersheds.org/artifacts/v1/production/objects/sha256/86/8633fe64725524fa36147da3dd3bc8b6bfdafb3e22516c88364ef237ed088b4d","verified":true},"metadata":{"bytes":240,"media_type":"application/json","sha256":"ba7b76fedd72768e8ec15237a442a1111795b27d8e6333d27b34197d46d6eb25","uri":"https://firewisewatersheds.org/artifacts/v1/production/objects/sha256/ba/ba7b76fedd72768e8ec15237a442a1111795b27d8e6333d27b34197d46d6eb25","verified":true},"soils":{"bytes":86484,"media_type":"application/vnd.apache.parquet","sha256":"de319e1c099fe635a7b82738412897c7faa359440918f8f12f491a1f9f3348f4","uri":"https://firewisewatersheds.org/artifacts/v1/production/objects/sha256/de/de319e1c099fe635a7b82738412897c7faa359440918f8f12f491a1f9f3348f4","verified":true},"subcatchments":{"bytes":3045759,"media_type":"application/geo+json","sha256":"7eead32503bd2f40fe4dc0f6fc4cfa28b52d80b787615ce2760c09dbc9a5d485","uri":"https://firewisewatersheds.org/artifacts/v1/production/objects/sha256/7e/7eead32503bd2f40fe4dc0f6fc4cfa28b52d80b787615ce2760c09dbc9a5d485","verified":true}},"display_name":"Mill Creek","expected":{"bounds":[-118.16247990797527,45.92780300416344,-117.90916082189915,46.06818791910978],"channels":4245,"subcatchments":2286,"watersheds":1},"runid":"some-oligopoly","watershed_key":"mill-creek"}],"schema_version":1,"source_revision":"weppcloud-20260718"}
