{"collection_key":"gate-creek","created_at":"2026-07-19T01:48:07Z","expected_member_count":1,"members":[{"aliases":[],"artifacts":{"boundary":{"bytes":215681,"media_type":"application/geo+json","sha256":"6068e34c326b344f717c9cb770f6306b916fd390e95a1d08d1fc7d0a89bad0f0","uri":"https://firewisewatersheds.org/artifacts/v1/production/objects/sha256/60/6068e34c326b344f717c9cb770f6306b916fd390e95a1d08d1fc7d0a89bad0f0","verified":true},"channels":{"bytes":1715448,"media_type":"application/geo+json","sha256":"7127570a7e42c186c41bfeef1e1c3b18258cd74192ff5a08429df9230e48c647","uri":"https://firewisewatersheds.org/artifacts/v1/production/objects/sha256/71/7127570a7e42c186c41bfeef1e1c3b18258cd74192ff5a08429df9230e48c647","verified":true},"hillslopes":{"bytes":156162,"media_type":"application/vnd.apache.parquet","sha256":"aa2c6fd5da64e6851e7c2f80e9a4bd2432a8b74324912910a851d0b9a17f3d0a","uri":"https://firewisewatersheds.org/artifacts/v1/production/objects/sha256/aa/aa2c6fd5da64e6851e7c2f80e9a4bd2432a8b74324912910a851d0b9a17f3d0a","verified":true},"landuse":{"bytes":48041,"media_type":"application/vnd.apache.parquet","sha256":"a7268d096425b3c69c4ef346718bc60e52bd39d7e007389220f23c70fa09e6d9","uri":"https://firewisewatersheds.org/artifacts/v1/production/objects/sha256/a7/a7268d096425b3c69c4ef346718bc60e52bd39d7e007389220f23c70fa09e6d9","verified":true},"metadata":{"bytes":217,"media_type":"application/json","sha256":"efd7b7c743c217ab2fc40ff850c11ba312c7404ce2883e8bd4cab2d28eb00a37","uri":"https://firewisewatersheds.org/artifacts/v1/production/objects/sha256/ef/efd7b7c743c217ab2fc40ff850c11ba312c7404ce2883e8bd4cab2d28eb00a37","verified":true},"soils":{"bytes":67005,"media_type":"application/vnd.apache.parquet","sha256":"490452cf4085e275a786865b5898cd12ab61f19b5df8f418ebd9fdbfc57542ab","uri":"https://firewisewatersheds.org/artifacts/v1/production/objects/sha256/49/490452cf4085e275a786865b5898cd12ab61f19b5df8f418ebd9fdbfc57542ab","verified":true},"subcatchments":{"bytes":3574066,"media_type":"application/geo+json","sha256":"6d5081203266b41865f8aabfdd9cc9b5c1a43406f609fdc2cebea02142e88197","uri":"https://firewisewatersheds.org/artifacts/v1/production/objects/sha256/6d/6d5081203266b41865f8aabfdd9cc9b5c1a43406f609fdc2cebea02142e88197","verified":true}},"display_name":"Gate Creek","expected":{"bounds":[-122.59469754898922,44.136408126924096,-122.38101285162367,44.23560270723474],"channels":4598,"subcatchments":3696,"watersheds":1},"runid":"aversive-forestry","watershed_key":"gate-creek"}],"schema_version":1,"source_revision":"weppcloud-20260718"}
