{"authentication":{"secret_ref":"WEPPCLOUD_JWT_TOKEN"},"collection_key":"bremerton","created_at":"2026-07-19T04:15:00Z","expected_member_count":3,"members":[{"aliases":[],"artifacts":{"boundary":{"bytes":16941,"media_type":"application/geo+json","sha256":"294472cc1639307c5f7c8e004fcaa3c15ca7b358cb0e97f05ca5cd4128c924d8","uri":"https://firewisewatersheds.org/artifacts/v1/production/objects/sha256/29/294472cc1639307c5f7c8e004fcaa3c15ca7b358cb0e97f05ca5cd4128c924d8","verified":true},"channels":{"bytes":122752,"media_type":"application/geo+json","sha256":"69c4829e627647a4b50609987026bc2dfb4fdf466fa7385b4f4ef86bf6ea194a","uri":"https://firewisewatersheds.org/artifacts/v1/production/objects/sha256/69/69c4829e627647a4b50609987026bc2dfb4fdf466fa7385b4f4ef86bf6ea194a","verified":true},"hillslopes":{"bytes":21692,"media_type":"application/vnd.apache.parquet","sha256":"cf3e85f70d86bf9bb43833a01bdc10c1c3f909f3e08f9a2be72a20d108ed6d7e","uri":"https://firewisewatersheds.org/artifacts/v1/production/objects/sha256/cf/cf3e85f70d86bf9bb43833a01bdc10c1c3f909f3e08f9a2be72a20d108ed6d7e","verified":true},"landuse":{"bytes":13094,"media_type":"application/vnd.apache.parquet","sha256":"cfe6450fc557d85fd402e14cc0722777ddc48098e710795fb296e0c1ea86ed95","uri":"https://firewisewatersheds.org/artifacts/v1/production/objects/sha256/cf/cfe6450fc557d85fd402e14cc0722777ddc48098e710795fb296e0c1ea86ed95","verified":true},"metadata":{"bytes":342,"media_type":"application/json","sha256":"b09c50405d80c2ff34c74b2eb07f979ab0e50761054abbe6ad17c00df06bffb7","uri":"https://firewisewatersheds.org/artifacts/v1/production/objects/sha256/b0/b09c50405d80c2ff34c74b2eb07f979ab0e50761054abbe6ad17c00df06bffb7","verified":true},"soils":{"bytes":20592,"media_type":"application/vnd.apache.parquet","sha256":"8ca517c639c28cbf5ca58893e833f9d264a756248373051a19986a4501145c48","uri":"https://firewisewatersheds.org/artifacts/v1/production/objects/sha256/8c/8ca517c639c28cbf5ca58893e833f9d264a756248373051a19986a4501145c48","verified":true},"subcatchments":{"bytes":244903,"media_type":"application/geo+json","sha256":"d49337fbc097f99bac7ae33b0e0fe43b4beaa426932094290010de42d450e31c","uri":"https://firewisewatersheds.org/artifacts/v1/production/objects/sha256/d4/d49337fbc097f99bac7ae33b0e0fe43b4beaa426932094290010de42d450e31c","verified":true}},"display_name":"Bremerton01","expected":{"bounds":[-122.80810038318566,47.523941111764216,-122.74620906064017,47.56951526127101],"channels":49,"subcatchments":115,"watersheds":1},"runid":"batch;;bremerton-2026-psbs;;bremerton01","watershed_key":"bremerton-01"},{"aliases":[],"artifacts":{"boundary":{"bytes":5534,"media_type":"application/geo+json","sha256":"540e4669bf8c6a7b9ff378f41d09a27bc44dd9e2eea4528d7df0a09acb9dd9c8","uri":"https://firewisewatersheds.org/artifacts/v1/production/objects/sha256/54/540e4669bf8c6a7b9ff378f41d09a27bc44dd9e2eea4528d7df0a09acb9dd9c8","verified":true},"channels":{"bytes":7229,"media_type":"application/geo+json","sha256":"978ef2ccfdb20cb610f50b8f5e6a5fbfc465adac419402fff19aae371efdff95","uri":"https://firewisewatersheds.org/artifacts/v1/production/objects/sha256/97/978ef2ccfdb20cb610f50b8f5e6a5fbfc465adac419402fff19aae371efdff95","verified":true},"hillslopes":{"bytes":11482,"media_type":"application/vnd.apache.parquet","sha256":"bef6e399f0b6507457b98f5fe33e8929eb9e47ae443b9e31f170eb6777dc7c2b","uri":"https://firewisewatersheds.org/artifacts/v1/production/objects/sha256/be/bef6e399f0b6507457b98f5fe33e8929eb9e47ae443b9e31f170eb6777dc7c2b","verified":true},"landuse":{"bytes":11528,"media_type":"application/vnd.apache.parquet","sha256":"61550d43ed0f8133ecacb5c4e24fd199353f3e1184ad77256012e97da41951e8","uri":"https://firewisewatersheds.org/artifacts/v1/production/objects/sha256/61/61550d43ed0f8133ecacb5c4e24fd199353f3e1184ad77256012e97da41951e8","verified":true},"metadata":{"bytes":341,"media_type":"application/json","sha256":"d5003d02318b3c7a4575d587dd218933e1de641352b2487ef5792363466fbf35","uri":"https://firewisewatersheds.org/artifacts/v1/production/objects/sha256/d5/d5003d02318b3c7a4575d587dd218933e1de641352b2487ef5792363466fbf35","verified":true},"soils":{"bytes":14424,"media_type":"application/vnd.apache.parquet","sha256":"e9c0733b144596c4ebac17ff8ed32cf0481d62f4d442e00f254380c8051966d9","uri":"https://firewisewatersheds.org/artifacts/v1/production/objects/sha256/e9/e9c0733b144596c4ebac17ff8ed32cf0481d62f4d442e00f254380c8051966d9","verified":true},"subcatchments":{"bytes":11303,"media_type":"application/geo+json","sha256":"04ec0962c0ae7928dbb128d182b973fd03c2d3433aeefc11d2c832c2f4ceb064","uri":"https://firewisewatersheds.org/artifacts/v1/production/objects/sha256/04/04ec0962c0ae7928dbb128d182b973fd03c2d3433aeefc11d2c832c2f4ceb064","verified":true}},"display_name":"Bremerton02","expected":{"bounds":[-122.77068632658003,47.52875270668978,-122.75309449575015,47.54411422865337],"channels":1,"subcatchments":3,"watersheds":1},"runid":"batch;;bremerton-2026-psbs;;bremerton02","watershed_key":"bremerton-02"},{"aliases":[],"artifacts":{"boundary":{"bytes":25134,"media_type":"application/geo+json","sha256":"2f6a946b2670cc7ad8cc830aad4effe883c6c947aaac8b4322e36c05a90a13ba","uri":"https://firewisewatersheds.org/artifacts/v1/production/objects/sha256/2f/2f6a946b2670cc7ad8cc830aad4effe883c6c947aaac8b4322e36c05a90a13ba","verified":true},"channels":{"bytes":228201,"media_type":"application/geo+json","sha256":"5bb7958f827c70ee1e64a14721f844f7a1b7214f6a9ded1eedfca5a726a8f06e","uri":"https://firewisewatersheds.org/artifacts/v1/production/objects/sha256/5b/5bb7958f827c70ee1e64a14721f844f7a1b7214f6a9ded1eedfca5a726a8f06e","verified":true},"hillslopes":{"bytes":29033,"media_type":"application/vnd.apache.parquet","sha256":"755cdd63ab14b615c08a9ffa08ef9d8f0b338df1a868e0901ffe1cbd07474f9c","uri":"https://firewisewatersheds.org/artifacts/v1/production/objects/sha256/75/755cdd63ab14b615c08a9ffa08ef9d8f0b338df1a868e0901ffe1cbd07474f9c","verified":true},"landuse":{"bytes":14693,"media_type":"application/vnd.apache.parquet","sha256":"d020c6f6301004ebb85a5af6a3229c896b39a6e51bd1f3d0c570971af0ada142","uri":"https://firewisewatersheds.org/artifacts/v1/production/objects/sha256/d0/d020c6f6301004ebb85a5af6a3229c896b39a6e51bd1f3d0c570971af0ada142","verified":true},"metadata":{"bytes":342,"media_type":"application/json","sha256":"e51f4740e7e2a7e2126a9efd24b3fd7a8ce898638b8b91310fe18e7d5769e76e","uri":"https://firewisewatersheds.org/artifacts/v1/production/objects/sha256/e5/e51f4740e7e2a7e2126a9efd24b3fd7a8ce898638b8b91310fe18e7d5769e76e","verified":true},"soils":{"bytes":24522,"media_type":"application/vnd.apache.parquet","sha256":"42b17dbbfcaa152efdbabef9faf3d929626c7ad76a3674efafa0075166b1dee0","uri":"https://firewisewatersheds.org/artifacts/v1/production/objects/sha256/42/42b17dbbfcaa152efdbabef9faf3d929626c7ad76a3674efafa0075166b1dee0","verified":true},"subcatchments":{"bytes":396641,"media_type":"application/geo+json","sha256":"fe3e32b322d91d7535ada5e476e88a75bb7e509da5b6311e104ffe805c4562fb","uri":"https://firewisewatersheds.org/artifacts/v1/production/objects/sha256/fe/fe3e32b322d91d7535ada5e476e88a75bb7e509da5b6311e104ffe805c4562fb","verified":true}},"display_name":"Bremerton03","expected":{"bounds":[-122.77153505893729,47.4895188985224,-122.7004510821885,47.55726299892485],"channels":85,"subcatchments":203,"watersheds":1},"runid":"batch;;bremerton-2026-psbs;;bremerton03","watershed_key":"bremerton-03"}],"schema_version":1,"source_revision":"wepp1-20260718-fb4197530ebc317e"}
